{
  "schema-version": 2,
  "kind": "core-snapshot",
  "host": "codex",
  "source-commit": "unverified",
  "created-utc": "2026-10-05 03:30 UTC",
  "files": {
    ".agents/skills/code-organization/SKILL.md": "d31c062b3cba71c28adc5aa1e9f6337d8cf98d312e72bffb9eb39b37a6a6ad07",
    ".agents/skills/compatibility-migration/SKILL.md": "7317d664b2e8d0c797cbbbd18c5f9df9b96b33fe45c6f2eceee465975cc202a3",
    ".agents/skills/debugging/SKILL.md": "6a80e36a9692b9b1e31b77bbb1d27309eb5734a01589127011ff2132daf5b00e",
    ".agents/skills/dependency-upgrade/SKILL.md": "e6d2e24c0540902c41b486b1979e8bca56793a8af8ee445293aeebdbbf6d8b83",
    ".agents/skills/implementation/SKILL.md": "d4d30412669ac92c1d881be1b2786c0cbf3d8c157f0f84b2aebcf327fe4e59f2",
    ".agents/skills/orchestration/SKILL.md": "9133e434c660d2a2769bf34c5ffe4909e21cebf9a095d42ec656a72a07fd0a29",
    ".agents/skills/performance-investigation/SKILL.md": "4d9a6c01a59c5a97ebcd25ffd44cc59c562eb405c8cb7ca7822ca5699b625f74",
    ".agents/skills/planning/SKILL.md": "6b58ffc55615d19971d0a4023970b962f86fef44644b688320cfee374ff0ad03",
    ".agents/skills/project-bootstrap/SKILL.md": "93efddaecab690dccf9a54716f26835d7016390530e628e54d4814b3ff7431ac",
    ".agents/skills/research/SKILL.md": "95c68607f5983ea48a9906e6623da3d106e19b33dd753bee44bc87f00305b281",
    ".agents/skills/review/SKILL.md": "c866f261f48c1a223b3e88d9b7e923bf2f49bb6ec9f12139c0d9e4724c442bf5",
    ".agents/skills/routing-configuration/SKILL.md": "4ac4201046e88edf1f1301000cabf9951cbc980f08eabf77cb17dcc9cb558510",
    ".agents/skills/skill-authoring/SKILL.md": "b723222fd867075ba84acb6ea5dba9f23d494968a2c524f8afa0e424734ac6e0",
    ".agents/skills/test-design/SKILL.md": "11970c3fe8f4d37670bbda4960edca88b269bdd710fed043ce1dc57f3c210ea5",
    ".agents/skills/validation/SKILL.md": "f0d01693a32c4910c753694636a14f5f5348547fa346b65d45283ffd02716aff",
    ".agents/skills/verification/SKILL.md": "99f0fb0ea8c263cdfb1bc08cf96cbc1fba067478ae974524f1c6a3c0e5d97974",
    ".codex/agents/analyst.toml": "595e0faefaefb5ca02a5627f1d02d9300ff3e225af0a6819cda7237f84210f70",
    ".codex/agents/architect.toml": "209211e61534e8c76685685131a2590ea60507e52a39604e79d4fc4a2d2966ee",
    ".codex/agents/researcher.toml": "446b4d7a23da470360ca4dfb32dbf42470bfce8bd8b304e6b12530cd1690a973",
    ".codex/agents/reviewer.toml": "ceabe860d0712268400415903f625ecec8a7a1c4d1bc0b2bd0958c1f58b9d2b9",
    ".codex/agents/steward.toml": "ba1909efca1ff43ad2e6b8ea6afbe7b8c15fcc272ef5e397a85f2c586ecf2f32",
    ".codex/agents/validator.toml": "9621f23d8aa01d3529edf8c5d59e87a7a2adbabcdef2f28d3655568990aa80b6",
    ".codex/agents/worker.toml": "730cdbc07744d86c57436630c5cf89e474d2516f04d27672e079e57d7a2b00ad",
    ".codex/config.toml": "26fa332e8df702bbe88d6516275e68f36ccf1cca791b31d3c56db96b3c0b8df2",
    ".embraion/.gitignore": "22f7c982ec0181e9b2c3add129c7dca9c2d4ae24bd541e631fd344dbea650161",
    ".embraion/agents.yaml": "ea78c7b5e834d9e6d89f74e6bdacf7c98e3be5d3c9ee308f45f534dc81f474e0",
    ".embraion/deployments.yaml": "f687290c4f5b1e19abe97e25820d6a545feb97f27dc51e37c35868122858aba1",
    ".embraion/knowledge.yaml": "afc4f5dd2f4a2c5921c56aec951c6405fc79292af2e44262adf0ab6cad23bf5e",
    ".embraion/policy.yaml": "2520ef0b75696245e442a14c59e3ce48d5ebdcf85b4c59f4cea342958d053057",
    ".embraion/project.yaml": "8894d1be9cfe78265ac6a28c0d650d9f897e1c5f486f665102d52668f6f872a3",
    ".embraion/routing.yaml": "8dcc41d0357205d9ef8c1f79c7b9e4aca1e6752779e48994117dd9c0158dc176",
    ".embraion/validation.yaml": "dfdaf47f321024cf26083ced9bc21cb8e533cc9805e2d6b735747f7aa624d586",
    "AGENTS.md": "8d14a9f7589acaa80880dd4a7cc4b724c1d063bfbb6203eaff73db6d65ffdaa3",
    "adapters/README.md": "1f644d9d6deb343cd05b0391aa2e940e40ef21f14ceebd3cef2cda1b944bdcaf",
    "adapters/claude-code/README.md": "da7fe5fcef0ac3aeded2ac909d41cb6b5041047ee0f69d839b498cfbb8f07d58",
    "adapters/claude-code/activation.md": "fa990d7bc3989aec169a7bdd7073a9c405575b6e09639b3b2a3cee8c421168e2",
    "adapters/claude-code/mods-probe/.claude-plugin/plugin.json": "0e5737d45bc84c4e0c3ae7a7d4bdb0ac9306cc81a1e331d32f057fb471f90445",
    "adapters/claude-code/mods-probe/README.md": "9b590776c48f5ab1da93fc53ba3f278f6ff663a01894469ff109c80aad747d59",
    "adapters/claude-code/mods-probe/hooks/hooks.json": "963c3dd3677e5853c033c4f99a81d5f35bb179f218f349a0485f8b29298ed386",
    "adapters/claude-code/mods-probe/hooks/register.js": "29952fd3062070d00d9e7ffa22ebb6370173c693639414c9973d6341bd7856f1",
    "adapters/claude-code/mods-probe/hooks/register.test.mjs": "4218e0932908980726907fc6dbce19575591019fa12faa5161d0ca1fa4a74ed6",
    "adapters/claude-code/mods-probe/package.json": "e406f4436e5509517528534331e24ad59371fa404814198cc9bc22e0b1685645",
    "adapters/claude-code/orchestration.md": "7187eb4218ac7218c9359ab0a3f33fa0be9f2d36598839b2060f8f20fc7d4575",
    "adapters/codex/README.md": "38dfc17fa92f7c86afe54714ed96d340dbc72f5c55c721852698087fafa17df6",
    "adapters/codex/orchestration.md": "3ad9ec23bafa6a8afffe96487a10ec856840124774d01b6013e7b9d8cb2e5485",
    "adapters/copilot/README.md": "841323fd8edf39dd3929f00e06ac1816693c96ee90ca35143c55d7768d298abb",
    "adapters/copilot/orchestration.md": "674263493fe36433127f336a39a507c0b03edc94e140ceef2f0677ac6f921ae9",
    "adapters/github/housekeeping.yaml": "01143727f94cf90e5b7c40aabd38173062373709c39d12bfa80275bca0fe581b",
    "adapters/harness-capabilities.yaml": "4e4ec973c605c454dbd140ec56309a0f586ff32ffc31079b7bd26671af4bc2cd",
    "adapters/portable/README.md": "1e41a8f5c1eff7c751c87910f82a022e7d1b56dc4eea5e3975fc84dc82b2aaa5",
    "adapters/portable/package.yaml": "de839c0e691977c7c40123382525421b6aadfab58ed393fe517b20542b97c7d6",
    "adapters/providers/README.md": "12095fc0c056de43025e1328bf71859b8abf629270513c5e7afcf6509a18795c",
    "adapters/providers/litellm/README.md": "7d47d00c86ed26ac47b133e9475ce994420170cf18ee808a6db6302322bc21f9",
    "core/README.md": "eeeb56f0cabd182b1292d764f439db0a06ffd2722f3b74d36d80c9367b33cafc",
    "core/agents/README.md": "91ea2b1da3a14a225e79dd5262cf586eb9589f5379c4864aaea025a677a4c31c",
    "core/agents/analyst.yaml": "bd066149678eab6d10d32effca2d957ef156937b4c7638ff072fee73b8dacf21",
    "core/agents/architect.yaml": "4e2e7ed3669e0a1e2ac4fe428516c9870b6184afb3aaab0a34f20d6e6b03eae3",
    "core/agents/lead.yaml": "a4d4b2aa583774723303f1e921ea5156152429dc626a2e9325ad84eed4a2cab6",
    "core/agents/researcher.yaml": "a47ef80324700d73c999975e7e68fce600fc55948048e9580c7512571919042e",
    "core/agents/reviewer.yaml": "f69884245de6e5daadc83e73155a1744db5368f5292aceb730853d87a04649d4",
    "core/agents/steward.yaml": "5571c08b6524296fd46d1f14ed3e20fd808896995c89268c7716e6c3142b2374",
    "core/agents/validator.yaml": "27e9ef2f75ef180972fd22fc1a791aca0053872f4d2543045add416660b2348e",
    "core/agents/worker.yaml": "cbc14c71a4dadce563aad58bf5b85b874c7063e14d8e6613ff26957c07af77d8",
    "core/catalog.yaml": "5e8b05bbbc9e7ca0d16092690967d9bd868d065781a52e52355faf278ff8efb9",
    "core/knowledge/README.md": "1b1a9bff342d0cfcc08be8dbbe72c16b01796ad7b67fc9d7894e51b7ec40809f",
    "core/knowledge/concepts.md": "ae33c8e9c21ad0bc460c72a3e9e697cf1867e55230d2451d5dfb2970fecdb8e4",
    "core/knowledge/glossary.md": "ba0f8d2a2b989bb82576cb2bf9f1ad4998e4de71d1c463617637028c63b8bc9a",
    "core/routing/README.md": "1c7beb215d652576192ffee9f4995502a615778425ee5a7b1023dd379acc1d34",
    "core/routing/access.yaml": "f347cc5a4e7a24399a5bd5ff22d66d8873478d514bad99c26ce347709a2deec4",
    "core/routing/complexity.yaml": "06af2d272169f58dff45f8cc6279bab3a12f5fb4a1cbccf9c9096134c1cd25ae",
    "core/routing/fallback.yaml": "d51147055aff9ad888c220bc28a5fa3c3a0ec6031152c7bfdbb7a32c886414e9",
    "core/routing/health.yaml": "0af94472cd374ab66eb12e1a9bf7856b1a082cb0e21b8b9b22d7aa4e2f34d502",
    "core/routing/privacy.yaml": "2b05ef8ef8cdc36deb0d639c6a13ffa999afed7b53d489cad2b8717dd79796bd",
    "core/rules/README.md": "25fee3dce096c96068303408cfb13aed4d1a3089133ace5da855b66348561984",
    "core/rules/artifact-authority.md": "3c8859a6a5fb04cdc2b7079b29b1d31e886bc256e2bec35bee7aca25ffd3eb00",
    "core/rules/classification.md": "f9a277815887b47b471c4fb634863428caa17ee389e30d34cce699e20f6574c4",
    "core/rules/compatibility.md": "b13c6a6a78c337a1b84f569819ec91ff58bdf4f1339d1a3604baffce0bfe183d",
    "core/rules/evidence.md": "f64bba8ff5b55d0bcd60d4a401b2dd24b1f9b9282458130236eeea9ba3c063e4",
    "core/rules/human-merge.md": "054d290b016df64deb69095df503b730c6434a6f3abdcdeadde1db5dc002914e",
    "core/rules/instructions.md": "f3dd583f76abea1cf146272aedc4d797f4a4509785ee95d4975a506f6885b5ce",
    "core/rules/integrations.md": "9cec97e9a5f50aba6a8cb069e11de640971ba3ea9d13281d997450d09d5da797",
    "core/rules/learning.md": "cbb9beab88eddde0f36909fdfb30245aab82a631e3cce9de40f255d0cd80a30d",
    "core/rules/minimum-change.md": "501c598d49054f9d7e3196daef4d06725c1888484aa86238423bd9d3d1a3ee04",
    "core/rules/ownership.md": "2653ea9b35f0f1bf33664e0b3ae4566f8371604dd383c8ca521d6f569efb3f0f",
    "core/rules/parallelism.md": "30ebe93db5445839ad415afe31e805ce76596d3cd4e59db82df1ff915c65dc53",
    "core/rules/review.md": "719d4257539a5c5a25f1c65b1e619aecbc6dd280a40aace0c2963aeb80aeef4f",
    "core/rules/security.md": "971727b49f6593f7f309ab94a7c1bff0934bf76990b3ef98336460f3ddd6c6a9",
    "core/rules/spec-kit.md": "52117892e7fea7662569b875bea7d8f4c434657cea16eeb82aa1eccc13564c8d",
    "core/skills/README.md": "039f23dff87fc9c7d03ba6b8c64e3934d047cb07f15d0aac892cde2012bc6473",
    "core/skills/code-organization/SKILL.md": "d31c062b3cba71c28adc5aa1e9f6337d8cf98d312e72bffb9eb39b37a6a6ad07",
    "core/skills/compatibility-migration/SKILL.md": "7317d664b2e8d0c797cbbbd18c5f9df9b96b33fe45c6f2eceee465975cc202a3",
    "core/skills/debugging/SKILL.md": "6a80e36a9692b9b1e31b77bbb1d27309eb5734a01589127011ff2132daf5b00e",
    "core/skills/dependency-upgrade/SKILL.md": "e6d2e24c0540902c41b486b1979e8bca56793a8af8ee445293aeebdbbf6d8b83",